
<?xml version= "1.0"encoding="UTF-8"?>

<!DOCTYPE book_catalog SYSTEM "book_catalog.dtd">
<book_catalog>
    <book>
        <id code="AN"/>
        <book_header>
            <book_name>Book name</book_name>
            <price>price</price>
            <cover_path path="../path"/>
        </book_header>
        <book_details>
            <summary>Summary text</summary>
            <publish_date>
                <date day="2" month="10" year="1989"/>
            </publish_date>
            <pages>234</pages>
            <cover_type type="soft"/>
            <rating>4.44</rating>
            <genres>
                <genre name="action"/>
            </genres>
            <publisher>publisher</publisher>
            <language name="bulgarian"/>
            <authors>
                <author>
                    <author_name>Author name</author_name>
                    <biography>biography</biography>
                    <published_books>published_books</published_books>
                    <nationality>nationality</nationality>
                    <birth_day>
                        <date day="23" month="5" year="1987"/>
                    </birth_day>
                </author>
            </authors>
        </book_details>
    </book>
</book_catalog>