<?xml version="1.0" encoding="utf-8" standalone="no"?>

<!DOCTYPE book_catalog SYSTEM "book_catalog.dtd">
<book_catalog>
    <book>
        <id code="A1"> </id>
        <book_header>
            <book_name>Жътварят</book_name>
            <price>9.00</price>
            <cover_path path="..\images\covers\zhatvaryat-30.jpg"/>
        </book_header>
        <book_details>
            <summary>Смърт го няма - смятат го за... хъм... изчезнал. А това причинява хаоса, който е задължителен след прекратяване на особено важна комунална услуга. Светът на Диска вече гъмжи от призраци и полтъргайсти. Активистът за правата на мъртъвците Рег Шу (един от девизите му гласи: "Защо търпите да ходят по вас?") изведнъж има повече работа, отколкото някога си е мечтал. А току-що починалият Уиндъл Пунс се събужда в ковчега и установява, че се е върнал към живота във вид на труп. И ето - на Уиндъл и не особено плашещата групичка неумрели в Анкх-Морпорк се пада мисията да опазят света на живите. През това време в малка ферма далеч, много далеч от града един висок мрачен непознат се оказва много сръчен с коса в ръцете. Има реколта за прибиране в хамбарите. И едно твърде странно единоборство за спечелване.</summary>
            <publish_date>
                <date year="1991"/>
            </publish_date>
            <pages>360</pages>
            <cover_type type="soft"/>
            <rating>5.60</rating>
            <genres>
                <genre name="fantasy"/>
            </genres>
            <publisher>Вузев</publisher>
            <language name="bulgarian"/>
            <authors>
                <author>
                    <author_name>Тери Пратчет</author_name>
                    <biography>Сър Тери Пратчет е британски писател, най-продаваният автор във Великобритания през 1990-те години. Най-известен е със серията си от комични фентъзи романи за Света на Диска. До декември 2007 г. е продал 55 милиона книги по света с преводи на 36 езика. Пратчет е вторият най-четен автор във Великобритания и седмият най-четен неамерикански автор в САЩ.</biography>
                    <published_books>104</published_books>
                    <nationality>британец</nationality>
                    <birth_day>
                         <date day="28" month="4" year="1948"/>
                    </birth_day>
                    <death_day>
                        <date day="12" month="3" year="2015"/>
                    </death_day>
                    </author>
            </authors>
        </book_details>
    </book>
</book_catalog>