<?xml version="1.0" encoding="utf-8" standalone="no"?>

<!DOCTYPE book_catalog SYSTEM "book_catalog.dtd">
<book_catalog>
    <book>
        <id code="A4"> </id>
        <book_header>
            <book_name>Майстора и Маргарита</book_name>
            <price>20</price>
            <cover_path path="..\images\covers\maistora-i-margarita.jpg"/>
        </book_header>
        <book_details>
            <summary>Един ден дяволът отива на посещение в Москва, за да проучи как се развива човечеството и как му се отразява съветският строй. С помощта на своята свита - двама демони, млада вещица и огромен черен котарак - той си прави с гражданството фантасмагорични шеги и го подлага на смеховити изпитания. Когато напуска земята, психиатричните заведения са пълни, а силите на реда са в смут... 
            Близо две хиляди години по-рано, в Юдея, римският прокуратор е принуден да потвърди смъртната присъда на един беден скитник философ, който изповядва странното убеждение, че всички хора са добри... Един московски историк пише роман за Пилат Понтийски и среща голямата, непобедима и извънвременна любов...
            Трите линии - сатиричната, трагичната и романтичната - са преплетени виртуозно и изграждат една от най-великите и обичани творби в световната литература. Завършен по времето на сталинските чистки, романът е публикуван за първи път едва през 1966 година, и то съкратен от цензурата с над сто страници. Днес вече е в пълния си вид и популярността му не спира да расте.</summary>
            <publish_date>
                <date year="2011"/>
            </publish_date>
            <pages>430</pages>
            <cover_type type="hard"/>
            <rating>5.70</rating>
            <genres>
                <genre name="fantasy"/>
                <genre name="novel"/>
            </genres>
            <publisher>Фама</publisher>
            <language name="bulgarian"/>
            <authors>
                <author>
                    <author_name>Михаил Булгаков</author_name>
                    <biography>Михаѝл Афана̀сиевич Булга̀ков (на руски: Михаил Афанасьевич Булгаков) е руски писател и драматург. 
                    Роден през 1891 година в руско семейство от средната класа в Киев, през 1916 година завършва медицина в Киевския университет. В годините на Първата световна война и Гражданската война работи като лекар в различни части на страната. След като не успява да емигрира, той се опитва да се приспособи към болшевишкия режим, като през 1921 година се установява в Москва с намерението да се занимава с литература.</biography>
                    <nationality>руснак</nationality>
                    <birth_day>
                         <date day="3" month="5" year="1891"/>
                    </birth_day>
                    <death_day>
                        <date day="10" month="3" year="1940"/>
                    </death_day>
                </author>
            </authors>
        </book_details>
    </book>
</book_catalog>